{
  "$schema": "https://json-schema.org/draft/2020-12/schema",
  "$id": "https://raw.githubusercontent.com/openwallet-foundation-labs/eudiplo/refs/heads/main/schemas/PresentationConfigCreateDto.schema.json",
  "title": "PresentationConfigCreateDto",
  "type": "object",
  "properties": {
    "id": {
      "type": "string",
      "description": "Unique identifier for the VP request."
    },
    "description": {
      "type": "string",
      "nullable": true,
      "description": "Description of the presentation configuration."
    },
    "lifeTime": {
      "type": "number",
      "description": "Lifetime how long the presentation request is valid after creation, in seconds."
    },
    "dcql_query": {
      "description": "The DCQL query to be used for the VP request.",
      "allOf": [
        {
          "$ref": "./DCQL.schema.json"
        }
      ]
    },
    "transaction_data": {
      "type": "array",
      "items": {
        "$ref": "./TransactionData.schema.json"
      }
    },
    "registrationCert": {
      "nullable": true,
      "description": "The registration certificate request containing the necessary details.",
      "type": "object",
      "allOf": [
        {
          "$ref": "./RegistrationCertificateRequest.schema.json"
        }
      ]
    },
    "webhook": {
      "nullable": true,
      "description": "Optional webhook URL to receive the response.",
      "type": "object",
      "allOf": [
        {
          "$ref": "./WebhookConfig.schema.json"
        }
      ]
    },
    "attached": {
      "nullable": true,
      "description": "Attestation that should be attached",
      "type": "array",
      "items": {
        "$ref": "./PresentationAttachment.schema.json"
      }
    },
    "redirectUri": {
      "type": "string",
      "nullable": true,
      "description": "Redirect URI to which the user-agent should be redirected after the presentation is completed.\nYou can use the `{sessionId}` placeholder in the URI, which will be replaced with the actual session ID.",
      "example": "https://example.com/callback?session={sessionId}"
    },
    "accessKeyChainId": {
      "type": "string",
      "nullable": true,
      "description": "Optional ID of the access certificate to use for signing the presentation request.\nIf not provided, the default access certificate for the tenant will be used.\n\nNote: This is intentionally NOT a TypeORM relationship because CertEntity uses\na composite primary key (id + tenantId), and SQLite cannot create foreign keys\nthat reference only part of a composite primary key. The relationship is handled\nat the application level in the service layer."
    }
  },
  "required": [
    "id",
    "dcql_query"
  ],
  "additionalProperties": false
}