{
    "id": "playground-pid",
    "description": "Full PID Verification - Complete identity verification for KYC, SIM activation, and similar use cases",
    "dcql_query": {
        "credentials": [
            {
                "id": "pid-sd-jwt",
                "format": "dc+sd-jwt",
                "meta": {
                    "vct_values": [
                        "urn:eudi:pid:de:1"
                    ]
                },
                "claims": [
                    {
                        "path": [
                            "given_name"
                        ]
                    },
                    {
                        "path": [
                            "family_name"
                        ]
                    },
                    {
                        "path": [
                            "birthdate"
                        ]
                    },
                    {
                        "path": [
                            "address",
                            "street_address"
                        ]
                    },
                    {
                        "path": [
                            "address",
                            "postal_code"
                        ]
                    },
                    {
                        "path": [
                            "address",
                            "locality"
                        ]
                    },
                    {
                        "path": [
                            "address",
                            "country"
                        ]
                    },
                    {
                        "path": [
                            "nationalities"
                        ]
                    }
                ],
                "trusted_authorities": [
                    {
                        "type": "etsi_tl",
                        "values": [
                            "https://bmi.usercontent.opencode.de/eudi-wallet/test-trust-lists/pid-provider.jwt"
                        ]
                    }
                ]
            },
            {
                "id": "pid-mso-mdoc",
                "format": "mso_mdoc",
                "meta": {
                    "doctype_value": "eu.europa.ec.eudi.pid.1"
                },
                "claims": [
                    {
                        "path": [
                            "eu.europa.ec.eudi.pid.1",
                            "given_name"
                        ],
                        "intent_to_retain": false
                    },
                    {
                        "path": [
                            "eu.europa.ec.eudi.pid.1",
                            "family_name"
                        ],
                        "intent_to_retain": false
                    },
                    {
                        "path": [
                            "eu.europa.ec.eudi.pid.1",
                            "birth_date"
                        ],
                        "intent_to_retain": false
                    },
                    {
                        "path": [
                            "eu.europa.ec.eudi.pid.1",
                            "resident_street"
                        ],
                        "intent_to_retain": false
                    },
                    {
                        "path": [
                            "eu.europa.ec.eudi.pid.1",
                            "resident_postal_code"
                        ],
                        "intent_to_retain": false
                    },
                    {
                        "path": [
                            "eu.europa.ec.eudi.pid.1",
                            "resident_city"
                        ],
                        "intent_to_retain": false
                    },
                    {
                        "path": [
                            "eu.europa.ec.eudi.pid.1",
                            "resident_country"
                        ],
                        "intent_to_retain": false
                    },
                    {
                        "path": [
                            "eu.europa.ec.eudi.pid.1",
                            "nationality"
                        ],
                        "intent_to_retain": false
                    }
                ],
                "trusted_authorities": [
                    {
                        "type": "etsi_tl",
                        "values": [
                            "https://bmi.usercontent.opencode.de/eudi-wallet/test-trust-lists/pid-provider.jwt"
                        ]
                    }
                ]
            }
        ],
        "credential_sets": [
            {
                "options": [
                    [
                        "pid-sd-jwt"
                    ],
                    [
                        "pid-mso-mdoc"
                    ]
                ]
            }
        ]
    },
    "lifeTime": 300
}