{
    "id": "hotel-guest",
    "description": "Hotel Guest Registration - Requests name, birthdate, and nationality for EU guest registration requirements",
    "dcql_query": {
        "credentials": [
            {
                "id": "pid-sd-jwt",
                "format": "dc+sd-jwt",
                "meta": {
                    "vct_values": [
                        "urn:eudi:pid:de:1"
                    ]
                },
                "claims": [
                    {
                        "path": [
                            "given_name"
                        ]
                    },
                    {
                        "path": [
                            "family_name"
                        ]
                    },
                    {
                        "path": [
                            "birthdate"
                        ]
                    },
                    {
                        "path": [
                            "nationalities"
                        ]
                    }
                ],
                "trusted_authorities": [
                    {
                        "type": "etsi_tl",
                        "values": [
                            "https://bmi.usercontent.opencode.de/eudi-wallet/test-trust-lists/pid-provider.jwt",
                            "<TENANT_URL>/trust-list/7f3f6c77-15d7-4ad1-a0e2-0d01bb3bf15e"
                        ]
                    }
                ]
            },
            {
                "id": "pid-mso-mdoc",
                "format": "mso_mdoc",
                "meta": {
                    "doctype_value": "eu.europa.ec.eudi.pid.1"
                },
                "claims": [
                    {
                        "path": [
                            "eu.europa.ec.eudi.pid.1",
                            "given_name"
                        ],
                        "intent_to_retain": false
                    },
                    {
                        "path": [
                            "eu.europa.ec.eudi.pid.1",
                            "family_name"
                        ],
                        "intent_to_retain": false
                    },
                    {
                        "path": [
                            "eu.europa.ec.eudi.pid.1",
                            "birth_date"
                        ],
                        "intent_to_retain": false
                    },
                    {
                        "path": [
                            "eu.europa.ec.eudi.pid.1",
                            "nationality"
                        ],
                        "intent_to_retain": false
                    }
                ],
                "trusted_authorities": [
                    {
                        "type": "etsi_tl",
                        "values": [
                            "https://bmi.usercontent.opencode.de/eudi-wallet/test-trust-lists/pid-provider.jwt"
                        ]
                    }
                ]
            }
        ],
        "credential_sets": [
            {
                "options": [
                    [
                        "pid-sd-jwt"
                    ],
                    [
                        "pid-mso-mdoc"
                    ]
                ]
            }
        ]
    },
    "lifeTime": 300
}